<?xml version="1.0"?>
<!DOCTYPE benchmark SYSTEM "benchmark.dtd">
<benchmark tool="cbmc">
  <test>
    <sourcefiles>
      <include>test/programs/simple/b*.cil.c</include>
    </sourcefiles>
    <options>
      <option name="--32"/>
      <option name="--error-label">ERROR</option>
      <option name="--unwind">100</option>
    </options>
  </test>
</benchmark>
